<?xml version="1.0" encoding="UTF-8" standalone="no"?>
<workflowMonitor xmlns:xsi="http://www.w3.org/2001/XMLSchema-instance"
	xmlns="http://www.example.org/wfInfo" xsi:schemaLocation="http://www.example.org/wfInfo wfInfo.xsd ">
	<workflow name="RedazioneArticolo">
		<simpleAction automaticallyIstantiated="false" name="Controllo"
			role="Redattore">
			<possibleNextAction>Revisione</possibleNextAction>
			<possibleNextAction>Pubblicazione</possibleNextAction>
		</simpleAction>
		<simpleAction automaticallyIstantiated="false" name="Revisione"
			role="Giornalista">
			<possibleNextAction>Controllo</possibleNextAction>
		</simpleAction>
		<simpleAction automaticallyIstantiated="false" name="Pubblicazione"
			role="Redattore" />
		<simpleAction automaticallyIstantiated="true" name="Scrittura"
			role="Giornalista">
			<possibleNextAction>Controllo</possibleNextAction>
		</simpleAction>
		<process startTime="2008-01-29T20:05:00+01:00">
			<actionStatus action="Scrittura" actor="Alessia Piccoli"
				terminationTime="2008-01-30T22:13:00+01:00" />
			<actionStatus action="Controllo" actor="Riccardo Perissino"
				terminationTime="2008-01-31T19:16:00+01:00" />
			<actionStatus action="Pubblicazione" />
		</process>
	</workflow>
	<workflow name="VenditaNormale">
		<simpleAction automaticallyIstantiated="true" name="EmissFattura"
			role="Contabile">
			<possibleNextAction>RicezPagamento</possibleNextAction>
		</simpleAction>
		<simpleAction automaticallyIstantiated="true" name="ConsegnaMerce"
			role="Magazziniere" />
		<simpleAction automaticallyIstantiated="false" name="RicezPagamento"
			role="Contabile" />
		<process startTime="2008-01-17T15:59:00+01:00">
			<actionStatus action="ConsegnaMerce" actor="Eva Trapani" />
			<actionStatus action="EmissFattura" />
		</process>
		<process startTime="2008-01-20T03:06:00+01:00">
			<actionStatus action="ConsegnaMerce" actor="Enrico Maria Verdi"
				terminationTime="2008-01-21T08:23:00+01:00" />
			<actionStatus action="EmissFattura" actor="Mauro Di Crescenzo"
				terminationTime="2008-01-22T05:06:00+01:00" />
			<actionStatus action="RicezPagamento" actor="Anna Baldo" />
		</process>
		<process startTime="2008-01-17T22:19:00+01:00">
			<actionStatus action="ConsegnaMerce" actor="Enrico Maria Verdi" />
			<actionStatus action="EmissFattura" actor="Mauro Di Crescenzo"
				terminationTime="2008-01-19T01:05:00+01:00" />
			<actionStatus action="RicezPagamento" actor="Anna Baldo" />
		</process>
		<process startTime="2008-01-26T21:55:00+01:00">
			<actionStatus action="ConsegnaMerce" />
			<actionStatus action="EmissFattura" />
		</process>
		<process startTime="2008-01-23T19:38:00+01:00">
			<actionStatus action="ConsegnaMerce" actor="Eva Trapani"
				terminationTime="2008-01-26T14:40:00+01:00" />
			<actionStatus action="EmissFattura" actor="Mauro Di Crescenzo"
				terminationTime="2008-01-24T19:57:00+01:00" />
			<actionStatus action="RicezPagamento" actor="Monica Lascarpa" />
		</process>
		<process startTime="2008-01-11T11:18:00+01:00">
			<actionStatus action="ConsegnaMerce" actor="Enrico Maria Verdi"
				terminationTime="2008-01-13T22:05:00+01:00" />
			<actionStatus action="EmissFattura" actor="Mauro Di Crescenzo"
				terminationTime="2008-01-12T16:47:00+01:00" />
			<actionStatus action="RicezPagamento" actor="Mauro Di Crescenzo" />
		</process>
		<process startTime="2008-01-19T05:08:00+01:00">
			<actionStatus action="ConsegnaMerce" actor="Eva Trapani"
				terminationTime="2008-01-19T13:32:00+01:00" />
			<actionStatus action="EmissFattura" actor="Monica Lascarpa"
				terminationTime="2008-01-20T00:43:00+01:00" />
			<actionStatus action="RicezPagamento" actor="Anna Baldo"
				terminationTime="2008-01-20T05:28:00+01:00" />
		</process>
	</workflow>
	<workflow name="GestioneVendita">
		<simpleAction automaticallyIstantiated="true" name="AccettazOrdine"
			role="AddettoVendite">
			<possibleNextAction>VenditaPagAnt</possibleNextAction>
			<possibleNextAction>VenditaNormale</possibleNextAction>
		</simpleAction>
		<processAction automaticallyIstantiated="false" name="VenditaPagAnt"
			role="RespVendite" actionWorkflow="VenditaPagAnt" />
		<processAction automaticallyIstantiated="false" name="VenditaNormale"
			role="RespVendite" actionWorkflow="VenditaNormale" />
		<process startTime="2008-01-18T11:20:00+01:00">
			<actionStatus action="AccettazOrdine" actor="Maurizio Tasca" />
		</process>
		<process startTime="2008-01-15T15:36:00+01:00">
			<actionStatus action="AccettazOrdine" actor="Francesca Pascal"
				terminationTime="2008-01-15T19:18:00+01:00" />
			<actionStatus action="VenditaNormale" />
		</process>
	</workflow>
	<workflow name="VenditaPagAnt">
		<simpleAction automaticallyIstantiated="false" name="ConsegnaMerce"
			role="Magazziniere" />
		<simpleAction automaticallyIstantiated="true" name="EmissFattura"
			role="Contabile">
			<possibleNextAction>RicezPagamento</possibleNextAction>
		</simpleAction>
		<simpleAction automaticallyIstantiated="false" name="RicezPagamento"
			role="Contabile">
			<possibleNextAction>ConsegnaMerce</possibleNextAction>
		</simpleAction>
		<process startTime="2008-01-12T12:11:00+01:00">
			<actionStatus action="EmissFattura" actor="Pier Luigi Castiglia"
				terminationTime="2008-01-13T23:06:00+01:00" />
			<actionStatus action="RicezPagamento" actor="Mario Orafi"
				terminationTime="2008-01-14T07:16:00+01:00" />
			<actionStatus action="ConsegnaMerce" actor="Elisabeth Tasca"
				terminationTime="2008-01-16T02:13:00+01:00" />
		</process>
	</workflow>
	<actor name="Alessia Piccoli" role="Giornalista" />
	<actor name="Riccardo Perissino" role="Redattore" />
	<actor name="Eva Trapani" role="Magazziniere" />
	<actor name="Enrico Maria Verdi" role="Magazziniere" />
	<actor name="Mauro Di Crescenzo" role="Contabile" />
	<actor name="Anna Baldo" role="Contabile" />
	<actor name="Monica Lascarpa" role="Contabile" />
	<actor name="Maurizio Tasca" role="AddettoVendite" />
	<actor name="Francesca Pascal" role="AddettoVendite" />
	<actor name="Pier Luigi Castiglia" role="Contabile" />
	<actor name="Mario Orafi" role="Contabile" />
	<actor name="Elisabeth Tasca" role="Magazziniere" />
</workflowMonitor>
